family,vendor,protocol_name,primary_technique,why_selected,key_overlap_points
DNA_extraction,QIAGEN,DNeasy Blood & Tissue,spin_column_tissue_purification,Canonical Qiagen silica spin-column genomic DNA workflow; widely recognized and explicitly bleach-incompatible in AL/AW1 flow-through.,Buffer ATL; Proteinase K; Buffer AL; ethanol (96–100%); Buffer AW1; Buffer AW2; Buffer AE
DNA_extraction,Thermo Scientific,GeneJET Genomic DNA Purification Kit,spin_column_genomic_dna,Common Thermo column workflow with explicit cultured-cell reagent volumes and clear wash/elution steps.,Lysis Solution; Proteinase K Solution; RNase A Solution; 50% ethanol; Wash Buffer I; Wash Buffer II; Elution Buffer
DNA_extraction,Thermo Scientific,MagJET Genomic DNA Kit,magnetic_bead_genomic_dna,Magnetic-bead genomic DNA purification with explicit manual cultured-cell protocol and reagent volumes.,0.15 M NaCl solution; Digestion Solution; Proteinase K Solution; RNase A Solution; Lysis Buffer; isopropanol; magnetic beads suspension; Wash Buffer 1; Wash Buffer 2; Elution Buffer
PCR,NEB,Q5 Hot Start High-Fidelity 2X Master Mix,high_fidelity_endpoint_pcr,High-fidelity PCR standard with explicit 50 µL reaction composition and Q5 cycling recommendations.,Q5 Hot Start High-Fidelity 2X Master Mix; Forward Primer; Reverse Primer; Template DNA; Nuclease-Free Water; mineral oil
PCR,Invitrogen,Platinum II Hot-Start PCR Master Mix (2X),hot_start_endpoint_pcr,Hot-start endpoint PCR with explicit 50 µL reaction setup and 60°C / 68°C routine cycling defaults.,"Platinum II Hot-Start PCR Master Mix (2X); Forward Primer; Reverse Primer; Template DNA; Water, nuclease-free; Platinum GC Enhancer"
PCR,Sigma-Aldrich,JumpStart REDTaq ReadyMix Reaction Mix,ready_mix_direct_load_pcr,High-throughput ready-mix PCR with direct-gel-loading dye and explicit 50 µL reaction framework.,JumpStart REDTaq ReadyMix; Forward primer; Reverse primer; Template DNA; PCR Reagent water; Mineral Oil; Betaine; DMSO
Bead_cleanup,Beckman Coulter,Agencourt AMPure XP PCR Purification,spri_bead_pcr_cleanup,"Canonical PCR cleanup workflow with explicit 1.8× bead ratio, 2×200 µL ethanol washes, and 40 µL elution.",Agencourt AMPure XP; Fresh 70% ethanol; Reagent Grade Water; TE Buffer; SPRIPlate magnet
Bead_cleanup,Thermo Scientific,MagJET NGS Cleanup and Size Selection Kit,magnetic_bead_ngs_cleanup,Manual/automated NGS cleanup workflow with explicit sample/bead/binding/wash/elution table and fresh Binding Mix requirement.,MagJET Magnetic Beads; Binding Mix; Wash Solution; Elution Buffer
Bead_cleanup,Axygen,AxyPrep Mag PCR Clean-up,paramagnetic_pcr_cleanup,"Simple PCR amplicon cleanup with explicit 1.8× ratio, 2×200 µL 70% ethanol wash, and 40 µL elution.",AxyPrep Mag PCR clean-up bead solution; 70% Ethanol; Reagent grade water; 10 mM TRIS-HCl pH 8.0; TE-like elution buffer
